{
  "as_of": "2026-10-24T16:44:24.787075+00:00",
  "count": 7,
  "dataset_version": "nanhai-2026-10-24-240",
  "generated_at": "2026-10-24T16:44:24.787075+00:00",
  "region": "佛山市南海区",
  "schema_version": "1.0.0",
  "signals": [
    {
      "actions": [
        {
          "audience": "souse",
          "parameters": {
            "indicator": "rent.market_avg",
            "period": "2024-02"
          },
          "requires_human": true,
          "suggested_step": "人工复核该租金基准是否仍适用于当前挂牌/补贴测算，勿以旧价直接定价",
          "type": "review",
          "urgency": "medium"
        }
      ],
      "audience": [
        "souse"
      ],
      "change": {
        "abs": null,
        "baseline": null,
        "direction": "flat",
        "method": "level_observation",
        "mom": null,
        "pct": null,
        "yoy": null
      },
      "confidence": 0.75,
      "evidence": [
        {
          "doc_id": "nh69ce4c0511",
          "published_at": "2024-02-18T00:00:00+00:00",
          "quote": "平均22元/㎡·月！南海最新住房租金水",
          "title": "平均22元/㎡·月！南海最新住房租金水平披露",
          "url": "http://www.nanhai.gov.cn/fsnhzsj/gkmlpt/content/5/5903/post_5903788.html"
        }
      ],
      "generated_at": "2026-10-24T16:44:24.787075+00:00",
      "generator": {
        "method": "rule",
        "model": null,
        "name": "build_signals",
        "version": "1.0.0"
      },
      "impact": {
        "affected": [
          "souse",
          "gate"
        ],
        "by_audience": {
          "gate": "neutral",
          "souse": "neutral"
        },
        "direction": "neutral",
        "horizon": "medium",
        "mechanism": "区域住房平均租金基准，用于校准挂牌价/补贴测算的参照系"
      },
      "indicator": {
        "code": "rent.market_avg",
        "dimension": "level",
        "name": "住房平均租金水平",
        "period": "2024-02",
        "unit": "元/㎡·月",
        "value": 22.0
      },
      "industries": [
        "housing_rental"
      ],
      "last_confirmed_at": "2024-02-18T00:00:00+00:00",
      "region": {
        "district": "佛山市南海区",
        "match_level": "district",
        "towns": []
      },
      "review": {
        "status": "auto"
      },
      "schema_version": "1.0.0",
      "scope": "rent_level",
      "signal_id": "sig_rent_level_nanhai_nh69ce4c0511_20240218",
      "status": "stale",
      "title": "平均22元/㎡·月！南海最新住房租金水平披露",
      "valid_from": "2024-02-18T00:00:00+00:00",
      "valid_until": "2025-02-17T00:00:00+00:00"
    },
    {
      "actions": [
        {
          "audience": "souse",
          "parameters": {
            "indicator": "housing.rent_policy"
          },
          "requires_human": true,
          "suggested_step": "核对补贴名单/政策口径，确认是否需要更新定价参数与配额",
          "type": "verify",
          "urgency": "medium"
        }
      ],
      "audience": [
        "souse"
      ],
      "change": {
        "abs": null,
        "baseline": null,
        "direction": "unknown",
        "method": "keyword_rule",
        "mom": null,
        "pct": null,
        "yoy": null
      },
      "confidence": 0.75,
      "evidence": [
        {
          "doc_id": "nh57860dae9b",
          "published_at": "2026-07-24T00:00:00+00:00",
          "quote": "一图读懂|《佛山市住房保障租赁补贴的实施意见》",
          "title": "一图读懂|《佛山市住房保障租赁补贴的实施意见》",
          "url": "http://fscz.foshan.gov.cn/cfg/zcjd2/content/post_7194279.html"
        }
      ],
      "generated_at": "2026-10-24T16:44:24.787075+00:00",
      "generator": {
        "method": "rule",
        "model": null,
        "name": "build_signals",
        "version": "1.0.0"
      },
      "impact": {
        "affected": [
          "souse",
          "gate"
        ],
        "by_audience": {
          "gate": "neutral",
          "souse": "neutral"
        },
        "direction": "neutral",
        "horizon": "medium",
        "mechanism": "租赁补贴/租金标准政策调整，改变补贴对象与定价约束，需同步核对定价口径"
      },
      "indicator": {
        "code": "housing.rent_policy",
        "dimension": "policy",
        "name": "住房租赁/补贴政策",
        "period": "2026-07",
        "unit": null,
        "value": null
      },
      "industries": [
        "public_housing",
        "social_security"
      ],
      "last_confirmed_at": "2026-07-24T00:00:00+00:00",
      "region": {
        "district": "佛山市南海区",
        "match_level": "district",
        "towns": []
      },
      "review": {
        "status": "auto"
      },
      "schema_version": "1.0.0",
      "scope": "rent_policy",
      "signal_id": "sig_rent_policy_nanhai_nh57860dae9b_20260724",
      "status": "active",
      "title": "一图读懂|《佛山市住房保障租赁补贴的实施意见》",
      "valid_from": "2026-07-24T00:00:00+00:00",
      "valid_until": "2027-07-24T00:00:00+00:00"
    },
    {
      "actions": [
        {
          "audience": "souse",
          "parameters": {
            "indicator": "housing.rent_policy"
          },
          "requires_human": true,
          "suggested_step": "核对补贴名单/政策口径，确认是否需要更新定价参数与配额",
          "type": "verify",
          "urgency": "medium"
        }
      ],
      "audience": [
        "souse"
      ],
      "change": {
        "abs": null,
        "baseline": null,
        "direction": "unknown",
        "method": "keyword_rule",
        "mom": null,
        "pct": null,
        "yoy": null
      },
      "confidence": 0.75,
      "evidence": [
        {
          "doc_id": "nh91c70102d6",
          "published_at": "2026-03-02T00:00:00+00:00",
          "quote": "各镇人民政府、街道办事处，各相关单位： 为培育和发展我区住房租赁市场，规范行业秩序，稳定市场预期，引导租赁双方合理定价和理性交易，促进住房租赁市场健康平稳发展，根据《住房租赁条例》（中华人民共和国国务院令第812号）、《关于发布房屋租赁市…",
          "title": "佛山市南海区住房城乡建设和水务局关于发布佛山市南海区2025年房屋租赁市场租金水平信息的通知",
          "url": "http://www.nanhai.gov.cn/fsnhslj/gkmlpt/content/7/7110/post_7110163.html"
        }
      ],
      "generated_at": "2026-10-24T16:44:24.787075+00:00",
      "generator": {
        "method": "rule",
        "model": null,
        "name": "build_signals",
        "version": "1.0.0"
      },
      "impact": {
        "affected": [
          "souse",
          "gate"
        ],
        "by_audience": {
          "gate": "neutral",
          "souse": "neutral"
        },
        "direction": "neutral",
        "horizon": "medium",
        "mechanism": "租赁补贴/租金标准政策调整，改变补贴对象与定价约束，需同步核对定价口径"
      },
      "indicator": {
        "code": "housing.rent_policy",
        "dimension": "policy",
        "name": "住房租赁/补贴政策",
        "period": "2026-03",
        "unit": null,
        "value": null
      },
      "industries": [
        "public_housing",
        "social_security"
      ],
      "last_confirmed_at": "2026-03-02T00:00:00+00:00",
      "region": {
        "district": "佛山市南海区",
        "match_level": "district",
        "towns": []
      },
      "review": {
        "status": "auto"
      },
      "schema_version": "1.0.0",
      "scope": "rent_policy",
      "signal_id": "sig_rent_policy_nanhai_nh91c70102d6_20260302",
      "status": "active",
      "title": "佛山市南海区住房城乡建设和水务局关于发布佛山市南海区2025年房屋租赁市场租金水平信息的通知",
      "valid_from": "2026-03-02T00:00:00+00:00",
      "valid_until": "2027-03-02T00:00:00+00:00"
    },
    {
      "actions": [
        {
          "audience": "souse",
          "parameters": {
            "indicator": "housing.public_rental_supply"
          },
          "requires_human": true,
          "suggested_step": "关注房源采购/配租进展，评估区域供给变化对定价与配额的边际影响",
          "type": "observe",
          "urgency": "low"
        }
      ],
      "audience": [
        "souse"
      ],
      "change": {
        "abs": null,
        "baseline": null,
        "direction": "unknown",
        "method": "keyword_rule",
        "mom": null,
        "pct": null,
        "yoy": null
      },
      "confidence": 0.75,
      "evidence": [
        {
          "doc_id": "nh11966a8924",
          "published_at": "2026-10-19T00:00:00+00:00",
          "quote": "1.招标条件佛山市仙岗赤坎保障性租赁住房项目已由上级主管部门批准实施，招标人为广东省佛山市南海区丹灶镇仙岗社区赤坎组集体经济组织，实施单位为佛山市南海区丹金新城开发集团有限公司，项目建设资金为自有资金。",
          "title": "佛山市仙岗赤坎保障性租赁住房项目——人行天桥工程选取公告",
          "url": "http://www.nanhai.gov.cn/fsnhq/bmdh/sydw/ggzyjyzx/jyxx/xegc/jygg/content/post_7326157.html"
        }
      ],
      "generated_at": "2026-10-24T16:44:24.787075+00:00",
      "generator": {
        "method": "rule",
        "model": null,
        "name": "build_signals",
        "version": "1.0.0"
      },
      "impact": {
        "affected": [
          "souse"
        ],
        "by_audience": {
          "souse": "positive"
        },
        "direction": "positive",
        "horizon": "medium",
        "mechanism": "公租房房源采购/配租推进增加可租房源，缓解供给约束，利于定价与配额管理"
      },
      "indicator": {
        "code": "housing.public_rental_supply",
        "dimension": "supply",
        "name": "公租房/保障房房源供给",
        "period": "2026-10",
        "unit": null,
        "value": null
      },
      "industries": [
        "public_housing",
        "housing_rental"
      ],
      "last_confirmed_at": "2026-10-19T00:00:00+00:00",
      "region": {
        "district": "佛山市南海区",
        "match_level": "town",
        "towns": [
          "丹灶镇"
        ]
      },
      "review": {
        "status": "auto"
      },
      "schema_version": "1.0.0",
      "scope": "rent_supply",
      "signal_id": "sig_rent_supply_danzao_nh11966a8924_20261019",
      "status": "active",
      "title": "佛山市仙岗赤坎保障性租赁住房项目——人行天桥工程选取公告",
      "valid_from": "2026-10-19T00:00:00+00:00",
      "valid_until": "2027-04-17T00:00:00+00:00"
    },
    {
      "actions": [
        {
          "audience": "souse",
          "parameters": {
            "indicator": "housing.public_rental_supply"
          },
          "requires_human": true,
          "suggested_step": "关注房源采购/配租进展，评估区域供给变化对定价与配额的边际影响",
          "type": "observe",
          "urgency": "low"
        }
      ],
      "audience": [
        "souse"
      ],
      "change": {
        "abs": null,
        "baseline": null,
        "direction": "unknown",
        "method": "keyword_rule",
        "mom": null,
        "pct": null,
        "yoy": null
      },
      "confidence": 0.75,